pid,date,archive_number,title,description,extent,condition,date_unvalidated,creator,collector,materials,collection,key,order,layout,notes,thumbnail,full
1,2023-10-25,23-01/1-4-1,Tinui Cub Scouts Sign,"Tinui Cub Scouts sign, grey metal painted white with text that reads ""Tinui Cub Scouts Troop"" and below ""Meet every 2nd Wednesday""",1,Good,Unknown,Unknown,Unknown,"Metal, Paint",tinui,object,000,tinui_item,"","",""
2,2023-10-25,23-01/1-4-2,Tinui Pony Club Sign,"Tinui Pony Club Sign, grey metal painted white with text that reads. ""Tinui Pony Club""",1,Fair,Unknown,Unknown,Unknown,"Metal, Paint",tinui,object,001,tinui_item,"","",""
3,2023-10-25,23-01/1-4-3,Leather Glove Sachet,"Leather gloves sachet for keeping gloves clean and safe, closed with a dome. Painted on the front are three lemons on a stem and the words ""GLOVE SACHET"" and ""KARAKA NZ.""",1,Good,Unknown,Unknown,Grant Perry,"Leather, Paint, Thread",tinui,object,002,tinui_item,"","",""
4,2023-10-25,23-01/1-4-4,Navy Blue Gloves  ,Navy blue wrist length gloves with machine embroidery. Formerly housed in leather gloves sachet ,1,Good,Unknown,Unknown,Grant Perry,"Synthetic stretch fabric, thread ",tinui,object,003,tinui_item,"","",""
5,2023-10-25,23-01/1-4-5,Hand Embroidered Bed Cover,"Hand Embroidered bed cover with a brunette woman with a plait on her left shoulder and long purple dress under a floral trelise, she is surrounded by flowers and it is bordered with lavender linen",1,Fair,1920-1930,Unknown,Unknown,"White and purple linen, embroidery thread",tinui,object,004,tinui_item,"","",""
6,2023-10-25,23-01/1-4-6,Hand Embroidered Pillow Cover,"Hand Embroidered pillow cover with a bust of a brunette woman with a plait on her left shoulder, she is surrounded by flowers and it is bordered with lavender linen",1,Fair,1920-1930,Unknown,Unknown,"White and purple linen, embroidery thread",tinui,object,005,tinui_item,"","",""
7,2023-10-25,23-01/1-4-7,Hand Embroidered Handkerchief ,"Hand Embroidered handkerchief with a bust of a brunette woman with a plait on her left shoulder, she is surrounded by flowers and bordered by a eyelet detail",1,Fair,1920-1930,Unknown,Unknown,"White linen, embroidery thread",tinui,object,006,tinui_item,"","",""
8,2023-10-25,23-01/1-4-8,Hand Embroidered Handkerchief ,"hand Embroidered handkerchief with a bust of a brunette woman with a plait on her left shoulder, she is surrounded by flowers and bordered by a eyelet detail",1,Fair,1920-1930,Unknown,Unknown,"White linen, embroidery thread",tinui,object,007,tinui_item,"","",""
9,2023-10-25,23-01/1-4-9,Pair of Black Open Toed Hannah's Pumps,"Black Open Toed Hannah's Pumps with embroidery detail on toe and four small beads on each. Writing on inside states ""Hannah, Size C 7, 714 SP624""",1,Good,Unknown,Unknown,Unknown,Black leather with tan leather interior and metal toe and heel pieces,tinui,object,008,tinui_item,Estimated 1930s - 1950s,"",""
10,2023-10-25,23-01/1-4-10,Green Floral Dress 1950s,"Green floral party dress with matching belt and collar detail. Label reads ""Exton, New Zealand""",1,Good,1950s,"Exton, New Zealand",Unknown,"Synthetic fabric, metal hardware, plastic buttons",tinui,object,009,tinui_item,"","",""
11,2023-10-25,23-01/1-4-11,"Barbers Chair, early 1900s ","Barbers Chair with red leather seat and headrest and black metal frame and footrest. Wooden trim around seat. Footplate reads ""Patented May. 21. 1878.""",1,Good,Unknown,Unknown,Unknown,"Leather, Metal, paint, wood",tinui,object,010,tinui_item,"","",""
12,2023-10-25,23-01/1-4-12,Brown Fur hat,Brown fur hat with leather inside. No label so may be handmade.,1,Good,Unknown,Unknown,Unknown,"Fur, Thread",tinui,object,011,tinui_item,"","",""
13,2023-10-25,23-01/1-4-13,Wicket basket with lid,Wicket basket with lid,1,Good,Unknown,Unknown,Unknown,Cane,tinui,object,012,tinui_item,"","",""
14,2023-10-25,23-01/1-4-14,Plastic doll with Blue Dress,Plastic doll with handmade blue Dress and blonde hair and blue eyes. Limbs are a pale pink while face is orange brown due to degredation. ,1,Fair,Unknown,Unknown,Unknown,"Plastic, fabric, metal, vinyl",tinui,object,013,tinui_item,Estimates 1950s - 1960s,"",""
15,2023-10-25,23-01/1-4-15,Brown snakeskin hat box,"Brown snakeskin hat box with handle and three locking metal clasps. Label is damaged but clearly reads ""Belliss""",1,Good,Unknown,Unknown,Belliss Family,"Snakeskin, metal, thread, fabric, leather",tinui,object,014,tinui_item,"Note inside reads ""The box and it's contents belong to Belliss""","",""
16,2023-10-25,23-01/1-4-16,Pair of Cream Crochet gloves ,Cream Crochet gloves ,1,Good,Unknown,Unknown,Belliss Family,Thread,tinui,object,015,tinui_item,"","",""
17,2023-10-25,23-01/1-4-17,Pair of Dark Blue gloves ,Pair of Dark Blue gloves with buttons and detailing on back of hands.,1,Fair,Unknown,Unknown,Belliss Family,"fabric, Thread, plastic",tinui,object,016,tinui_item,"","",""
18,2023-10-25,23-01/1-4-18,Pale blue headpiece with fabric rose,Pale blue headpiece with fabric rose,1,Fair,Unknown,Unknown,Belliss Family,"Wire, Thread, Fabric",tinui,object,017,tinui_item,"","",""
19,2023-10-25,23-01/1-4-19,"Small black handbag, 1940s","Small black handbag with metal clasp and frame. Inside is a small pcoket containing a hand mirror. Attached was a note that reads ""for the nights we dressed up to go dancing etc. after the dreary W.W.II years.""",1,Fair,1940s,Unknown,Belliss Family,"Metal, Fabric, Thread",tinui,object,018,tinui_item,"","",""
20,2023-10-25,23-01/1-4-20,Cream Crochet handbag,Cream Crochet handbag with no strap or clasps. Cream silky inside.,1,Good,Unknown,Unknown,Belliss Family,"Plastic, Fabric, Thread.",tinui,object,019,tinui_item,"","",""
21,2023-10-25,23-01/1-4-21,Blue Cotton Handkerchief,Blue Cotton Handkerchief,1,Good,Unknown,Nash's Leather Arcade. 133-135 Cuba Street. Wellington. N.Z.,Belliss Family,"fabric, Thread",tinui,object,020,tinui_item,"","",""
22,2023-10-25,23-01/1-4-22,Grey Snakeskin Hatbox,"Grey snakeskin hat box with handle and three locking metal clasps. Lined with pink floral fabric. Inside is a label that reads ""Nash's Leather Arcade. 133-135 Cuba Street. Wellington. N.Z.""",1,Good,Unknown,Unknown,Unknown,"Snakeskin, metal, thread, fabric, leather",tinui,object,021,tinui_item,"","",""
23,2023-10-25,23-01/1-4-23,Black hat with white fabric flowers,"Black hat with white fabric flowers and bows. Inside is partially illegible writing, it reads ""W. 1958"" ",1,Good,1958,Unknown,Unknown,"fabric, Thread, plastic",tinui,object,022,tinui_item,"","",""
24,2023-10-25,23-01/1-4-24,Washing Board,Light brown wood washing board with textured glass inset.,1,Good,Unknown,Unknown,Unknown,"Wood, glass",tinui,object,023,tinui_item,"","",""
25,2023-10-25,23-01/1-4-25,Red dress with lace collar and sleeves,Red dress with lace collar and sleeves,1,Good,Unknown,Unknown,Unknown,"fabric, Thread",tinui,object,024,tinui_item,Estimated 1930s - 40s based on style,"",""
26,2023-10-25,23-01/1-4-26,White doily with lace trim,Circular white doily with lace trim,1,Good,Unknown,Unknown,Unknown,"fabric, Thread",tinui,object,025,tinui_item,"","",""
27,2023-10-25,23-01/1-4-27,Travelling Case belonging to W.H French,"Brown leather travelling case with green fabric interior. Tag reads ""W.H French, Sydney""",1,Good,Unknown,Unknown,French Family,"Leather, Fabric, Thread, Metal",tinui,object,026,tinui_item,"","",""
28,2023-10-25,23-01/1-4-28,Oval Leather case with buckle,"Soft brown oval leather case with buckle, stamped into leather on front ""MADE IN ENGLAND"". Potentially designed to hold the brushes found with it. ",1,Fair,Unknown,Unknown,French Family,"Leather, Fabric, Thread, Metal",tinui,object,027,tinui_item,Inside French case,"",""
29,2023-10-25,23-01/1-4-29,Bristle brushes with wooden handles,Two identical bristle brushes with orange bristles and wooden handles,2,Good,Unknown,Unknown,French Family,"Plastic, Wood",tinui,object,028,tinui_item,"Inside French case, likely for animals","",""
30,2023-10-25,23-01/1-4-31,Butter Churn,"Butter churn, description from attached tag ""made from K white pine - as the wood did not taint the cream. (All butter exported before 1950 was in boxes of this timber""",1,Good,Unknown,Unknown,Unknown,"Wood, metal",tinui,object,029,tinui_item,"","",""
31,2023-10-25,23-01/1-4-32,Cream Can,"Rusted metal cream can with 173 painted on in yellow. Attached tag reads ""Dairy farmers sent cream only to butter factories. The skin milk was used to feed calves, with additives, and pigs. This way a small herd could be quite profitable. The advent of milk tankers stopped this.""",1,Fair,Unknown,Unknown,Unknown,"Metal, Paint",tinui,object,030,tinui_item,"","",""
32,2023-10-25,23-01/1-4-33,Early 1900s Wooden High chair,Early 1900s Wooden High chair. For description see attached image. ,1,Good,Unknown,Unknown,Atack Family,"Wood, nails",tinui,object,031,tinui_item,Estimated early 1900s,"",""
33,2023-10-25,23-01/1-4-34,Aunt Daisy's Book of Handy Hints,"Aunt Daisy's Book of Handy Hints: 170 pages of valuable hints for the housewife. Belonged to Miss H. Scott. 61c Oban Street Wadestown, Wellington. Miss Scott was a teacher for the correspondence school from 1922 to 1944. ",1,Fair,1950s,Whitcombe & Tombs LTD.,Belliss Family,Paper,tinui,object,032,tinui_item,Enclosed is handwritten recipe for Madeira cake ,"",""
34,2023-10-25,23-01/1-4-35,Ceramic jug for Arsenate of Lead,Ceramic jug for Arsenate of Lead (a pesticide used primarily in fruit orchards),1,Good,Unknown,Unknown,Unknown,"Ceramic, metal, paint",tinui,object,033,tinui_item,"","",""
35,2023-10-25,23-01/1-4-36,Bowl and lid with pink flowers,Ceramic bowl and lid with pink flower print,1,Good,Unknown,Unknown,Unknown,"Ceramic, paint",tinui,object,034,tinui_item,Estimated 1950s,"",""
36,2023-10-25,23-01/1-4-37,Vase with pink flowers,Ceramic vase with pink flowers,1,Good,Unknown,Unknown,Unknown,"Ceramic, paint",tinui,object,035,tinui_item,"","",""
37,2023-10-25,23-01/1-4-38,The New Zealand Scouts Handbook,"The New Zealand Scouts Handbook. Writing on the inside reads ""To Grant, Good Hunting, from (unclear but possibly) Akela""",1,Good,1964,The Boys Scouts Association of New Zealand,Unknown,Paper,tinui,object,036,tinui_item,Could be Grant Perry?,"",""
38,2023-10-25,23-01/1-4-39,Simple Guide to Weddings,Simple Guide to Weddings,1,Good,Unknown,Whitcombe & Tombs LTD.,Grant Perry,Paper,tinui,object,037,tinui_item,"","",""
39,2023-10-25,23-01/1-4-40,Embroidered pouch with flower,"Embroidered pouch with flower, likely a pansy or violet. Purple thread makes up the petals and brown and yellow make up the centre. The flower is bordered by a crochet edge. ",1,Good,Unknown,Unknown,Unknown,"fabric, Thread",tinui,object,038,tinui_item,"","",""
40,2023-10-25,23-01/1-4-41,Wairarapa Rugby Football Union Itinerary,Wairarapa Rugby Football Union Itinerary,1,Good,1958,Wairarapa Rugby Football Union,Unknown,Paper,tinui,object,039,tinui_item,"","",""
41,2023-10-25,23-01/1-4-42,Ancient Order of Foresters Rulebook,Ancient Order of Foresters Rulebook,1,Good,Unknown,Unknown,Grant Perry,Paper,tinui,object,040,tinui_item,"","",""
42,2023-10-25,23-01/1-4-43,Educational Broadcasts to Schools 1948,This Educational Broadcasts to Schools pamphlet belonged to Mataikora School teacher Miss Pavitt,1,Good,1948,"New Zealand Broadcasting Service, Anne Rowley",Grant Perry,Paper,tinui,object,041,tinui_item,"","",""
43,2023-10-25,23-01/1-4-44,Tinui Rifle Club Smith Cup,"Tinui Rifle Club Smith Cup, silver cup with engraved words and plastic base",1,Good,Unknown,Unknown,Unknown,"Metal, Plastic",tinui,object,042,tinui_item,"","",""
44,2023-10-25,23-01/1-4-45,Tinui Rifle Club Ratanui Cup,"Tinui Rifle Club Ratanui Cup, silver cup with engraved words and plastic base",1,Good,Unknown,Unknown,Unknown,"Metal, Plastic",tinui,object,043,tinui_item,"","",""
45,2023-10-25,23-01/1-4-46,Silver Plated Coffee Pot,"Silver Plated Coffee Pot with glass top and plastic handle. Attached note reads ""For Tinui Museum. From Mrs. Brenda Perry via Phyllis Merkle. Wedding Present 1952.""",1,Good,1952,"Towercrome Plate, Wolverhampton England",Brenda Perry,"Metal, Glass, Plastic",tinui,object,044,tinui_item,"","",""
46,2023-10-25,23-01/1-4-47,Child's Fleece Smock with Embroidered Flowers,Child's White Fleece Smock with Embroidered Flowers at the neck and lace details.,1,Good,Unknown,Unknown,Grant Perry,"fabric, Thread",tinui,object,045,tinui_item,"","",""
47,2023-10-25,23-01/1-4-48,White baby jacket with embroidered flowers,"White baby jacket with embroidered flowers, a white pearl button, and long sleeves with smocking detail.",1,Good,Unknown,Unknown,Grant Perry,"fabric, Thread",tinui,object,046,tinui_item,"","",""
48,2023-10-25,23-01/1-4-49,White knitted baby bonnet with ribbons,White knitted baby bonnet with eyelet pattern and ribbon ties,1,Good,Unknown,Unknown,Grant Perry,"wool, Thread, ribbons",tinui,object,047,tinui_item,"","",""
49,2023-10-25,23-01/1-4-50,Money bags from the Tinui Post Office,"Money bags from the Tinui Post Office, linen bags that read ""This bag is property of Bank of New Zealand: The Dominion's Largest Trading Bank R/67""",3,Good,Unknown,Bank of New Zealand,Unknown,"Linen, Thread",tinui,object,048,tinui_item,"","",""
50,2023-10-25,23-01/1-4-51,Money bag from the Tinui Post Office,"Money bag from the Tinui Post Office, linen bag that reads ""This bag is property of Bank of New Zealand: The Dominion's Largest Trading Bank R/56""",1,Good,Unknown,Bank of New Zealand,Unknown,"Linen, Thread",tinui,object,049,tinui_item,"","",""
51,2023-10-25,23-01/1-4-52,Set of Butter Pats,Set of grooved wooden butter pats,1,Good,Unknown,Unknown,Unknown,Wood,tinui,object,050,tinui_item,"","",""
52,2023-10-25,23-01/1-4-53,World War One water bottle carrier,"World War One leather water bottle carrier, buckled to the saddle for the cavalry. ",1,Fair,1910s,Unknown,Unknown,"Leather, metal, Thread",tinui,object,051,tinui_item,"","",""
53,2023-10-25,23-01/1-4-54,White Ceramic Serving dish lid ,White Ceramic Serving dish lid with handle and vine pattern,1,Fair,Unknown,Unknown,Mr & Mrs Hugh Belliss,"Ceramic, paint",tinui,object,052,tinui_item,Labels says 1880? Possible date,"",""
54,2023-10-25,23-01/1-4-55,Wooden hat stand,Wooden hat stand,1,Good,Unknown,Unknown,Unknown,Wood,tinui,object,053,tinui_item,"Top and base are not attached, take care when lifting","",""
55,2023-10-25,23-01/1-4-56,White cotton christening gown,"White cotton christening gown with insertion lace in front and lace at collar, cuffs, and hem.",1,Good,Unknown,Unknown,Unknown,"fabric, Thread",tinui,object,054,tinui_item,"","",""
56,2023-10-25,23-01/1-4-57,Embroidered pouch full of drief lavender,Embroidered pouch full of drief lavender. Net fabric with lavender embroidered on the front. Springs kept in place with a cream ribbon. Edges finished with blanket stitch in purple. ,1,Good,Unknown,Unknown,Unknown,"fabric, Thread, dried lavender",tinui,object,055,tinui_item,"","",""
57,2023-10-25,23-01/1-4-58,Glass bottle with metal handle,"Glass bottle with rusted metal handle and ""GLOBE"" imprinted into the glass",1,Good,Unknown,Unknown,Unknown,"Metal, Glass",tinui,object,056,tinui_item,"","",""
58,2023-10-25,23-01/1-4-59,White cotton christening gown,"White cotton christening gown with insertion lace in front and lace at collar, cuffs, and hem.",1,Good,Unknown,Unknown,Grant Perry,"fabric, Thread",tinui,object,057,tinui_item,"","",""
59,2023-10-25,23-01/1-4-60,Cream Crochet doily rectangular,"Cream Crochet doily, rectangular. Made up of smaller circles they are three by four. ",1,Good,Unknown,Unknown,Unknown,Thread,tinui,object,058,tinui_item,"","",""
60,2023-10-25,23-01/1-4-61,Embroidered table runner with blue and pink flowers,"Embroidered table runner, herringbone stitched around edges in blue, black, and pink. At each end is a black circle surrounded by blue and pink flowers.",1,Fair,Unknown,Unknown,Unknown,"fabric, Thread",tinui,object,059,tinui_item,"","",""
61,2023-10-25,23-01/1-4-62,Embroidered table runner with black squares,"Embroidered table runner, the edging is in blue linen and it feature black running stitch borders with bold pink and purple flowers inside.",1,Good,Unknown,Unknown,Unknown,"fabric, Thread",tinui,object,060,tinui_item,"","",""
62,2023-10-25,23-01/1-4-63,Embroidered table runner with purple edging,"Embroidered table runner, the edging is in purple linen and it feature black running stitch borders with bold pink and purple flowers inside.",1,Good,Unknown,Unknown,Unknown,"fabric, Thread",tinui,object,061,tinui_item,"","",""
63,2023-10-25,23-01/1-4-64,Cream Crochet doily small,"Cream Crochet doily small, five concentric circles of ruffles making a round doily  ",1,Good,Unknown,Unknown,Unknown,Thread,tinui,object,062,tinui_item,"","",""
64,2023-10-25,23-01/1-4-65,Cream Crochet doily large,"Cream Crochet doily large, two concentric circles of large ruffles making a round doily  ",1,Good,Unknown,Unknown,Unknown,Thread,tinui,object,063,tinui_item,"","",""
65,2023-10-25,23-01/1-4-66,Embroidered table runner with white lace edging,Embroidered table runner with white lace edging and insertion lace sections,1,Fair,Unknown,Unknown,Unknown,"fabric, Thread",tinui,object,064,tinui_item,"","",""
66,2023-10-25,23-01/1-4-67,Cot mattress cover,Cot mattress cover with leaves and vines in white embroidery and ruffles fabric edges.,1,Good,Unknown,Unknown,Unknown,"fabric, Thread",tinui,object,065,tinui_item,"","",""
67,2023-10-25,23-01/1-4-68,Embroidered handkerchief with lambs,Embroidered handkerchief with pink lambs and flowers in corners and lace edging.,1,Fair,Unknown,Unknown,Unknown,"fabric, Thread",tinui,object,066,tinui_item,"","",""
68,2023-10-25,23-01/1-4-69,Cardboard box for boot polish,"Cardboard box for boot polish. Top reads ""Nugget: Brown boot polishing outfit.""",1,Fair,1960,Unknown,Unknown,"Cardboard, ink",tinui,object,067,tinui_item,"","",""
69,2023-10-25,23-01/1-4-70,"Life preserver from the S S Ripple, Napier","Life preserver from the S S Ripple, Napier",1,Good,Unknown,Unknown,Unknown,"Rope, ???",tinui,object,068,tinui_item,"","",""
70,2023-10-25,23-01/1-4-71,Child's car seat,"Child's car seat made from wood, metal and leather with straps to attach it to the car.",1,Good,Unknown,Unknown,Unknown,"Wood, Metal, Leather, Plastic",tinui,object,069,tinui_item,"","",""
71,2023-10-25,23-01/1-4-72,Glass jar with lid ,"Glass jar with lid and metal clips on the side. Lid and front read ""Agee Queen"" ",1,Fair,Unknown,Unknown,Unknown,"Glass, metal",tinui,object,070,tinui_item,"","",""
72,2023-10-25,23-01/1-4-73,Bundt cake tin,Metal Bundt cake tin with screw on lid and handle.,1,Good,Unknown,Unknown,Unknown,Metal,tinui,object,071,tinui_item,"","",""
73,2023-10-25,23-01/1-4-74,Electric kettle ,"Electric kettle with plastic handle grip, removable lid, and plug socket.",1,Good,Unknown,"Bulpitt & Sons Ltd. Birmingham, England",Belliss Family,"Metal, plastic",tinui,object,072,tinui_item,"","",""
74,2023-10-25,23-01/1-4-75,Rolled Oats Bag,"Rolled Oats Bag, Linen. Text reads ""Buchanan Rolled Oats"" and in the centre there is an illustration of the oats.",1,Good,Unknown,Buchanan's,Unknown,"Linen, Thread, Ink",tinui,object,073,tinui_item,"","",""
75,2023-10-25,23-01/1-4-76,"""Temptingly Sheer"" stockings in bag","""Temptingly Sheer"" stockings in unopened bag. Bag reads ""Temptingly Sheer: For the Young at Heart. Temptation Bri-Nylon. 15 Dernier Service Sheer"". Contains photo of Frank Sinatra.",1,Good,1960s,Unknown,Unknown,"Plastic, Cardboard, Nylon",tinui,object,074,tinui_item,Packaging suggests 1960s,"",""
76,2023-10-25,23-01/1-4-77,Mystique Seam Free stockings,"Mystique Seam Free stockings, in packet. Cover is red with a woman's face. She has a bob and is wearing 1960s make up. ",1,Good,1960s,Unknown,Unknown,"Plastic, Cardboard, Nylon",tinui,object,075,tinui_item,"","",""
77,2023-10-25,23-01/1-4-78,Cherish Seamfree stockings,"Cherish Seamfree stockings, in bag, packaging is white and green.",1,Good,1960s,Prestige,Unknown,"Plastic, Cardboard, Nylon",tinui,object,076,tinui_item,"","",""
78,2023-10-25,23-01/1-4-79,Columbine Purse Pack Stockings,"Columbine Purse Pack Stockings, in bag, packaging is red and white with a woman's legs in gold heels. Under her is the slogan ""A Pair and a Spare""",1,Good,1960s,Columbine,Unknown,"Plastic, Cardboard, Nylon",tinui,object,077,tinui_item,"","",""
79,2023-10-25,23-01/1-4-80,Prestige Ultrasoft Sheer Nylons,"Prestige Ultrasoft Sheer Nylons, in bag, packaging is white with a clear window bordered with gold",1,Good,1960s,Prestige,Unknown,"Plastic, Cardboard, Nylon",tinui,object,078,tinui_item,"","",""
80,2023-10-25,23-01/1-4-81,Pair of sheer brown tights in clear bag,"Pair of sheer brown tights in clear bag, no brand, only a label on the back that reads ""Spring tone. NZ.""",1,Good,Unknown,Unknown,Unknown,"Plastic, Cardboard, Nylon",tinui,object,079,tinui_item,"","",""
81,2023-10-25,23-01/1-4-82,Pair of sheer brown tights,"Pair of sheer brown tights with opaque toes, heels, and waistband",1,Good,Unknown,Unknown,Unknown,"Plastic, Cardboard, Nylon",tinui,object,080,tinui_item,"","",""
82,2023-10-25,23-01/1-4-83,Two pairs of sheer brown tights in clear bag,"Two pairs of sheer brown tights in clear bag, one is a true brown, the other a rusty red brown. The bag has no brand names or labels",1,Good,Unknown,Unknown,Unknown,"Plastic, Cardboard, Nylon",tinui,object,081,tinui_item,"","",""
83,2023-10-25,23-01/1-4-84,Tinui & Districts Lions wall hanging,"Tinui & Districts Lions wall hanging, black felt with Text and images of sheep and a tree and the lions logo.",1,Good,1973,Unknown,Unknown,"Fabric, Thread, Wood, Ink",tinui,object,082,tinui_item,"","",""
84,2023-10-25,23-01/1-4-85,Chicken feed sack,"Chicken feed sack with graphic of roster on front. Text reads ""20.lb Quality Product No. 1 Laying Mash.""",1,Good,Unknown,Timaru Milling Co. ,Unknown,"Linen, Thread, Ink",tinui,object,083,tinui_item,"","",""
85,2023-10-25,23-01/1-4-86,"Skin of a small animal (ferret?), red brown",Skin of a small animal (ferret?),1,Good,Unknown,Unknown,Unknown,Ferret Skin and fur,tinui,object,084,tinui_item,"","",""
86,2023-10-25,23-01/1-4-87,"Skin of a small animal (ferret?), brown","Skin of a small animal (ferret?), brown",2,Good,Unknown,Unknown,Unknown,Ferret Skin and fur,tinui,object,085,tinui_item,"","",""
87,2023-10-25,23-01/1-4-88,Floral baby bib,Floral baby bib with blue binding,1,Fair,Unknown,Unknown,Unknown,"fabric, Thread",tinui,object,086,tinui_item,"","",""
88,2023-10-25,23-01/1-4-89,Frockmaster Hem-Leveller ,"Frockmaster Hem-Leveller, metal device in cardboard box ",1,Good,Unknown,A.W. Brown & Company,Unknown,"Metal, Paint, Fabric",tinui,object,087,tinui_item,"","",""
89,2023-10-25,23-01/1-4-90,Hanson Metal Scale,Hanson Metal Scale,1,Good,Unknown,Unknown,Unknown,"Metal, Glass, Paint",tinui,object,088,tinui_item,"","",""
90,2023-10-25,23-01/1-4-91,Unidentified rusted metal piece (possibly a lamp) ,Unidentified rusted metal piece (possibly a lamp) ,1,Fair,Unknown,Unknown,Unknown,Metal,tinui,object,089,tinui_item,"","",""
91,2023-10-25,23-01/1-4-92,Large Ceramic Jug,"Large Ceramic Jug, with handle and stopper",1,Good,Unknown,Unknown,Unknown,"Ceramic, paint",tinui,object,090,tinui_item,"","",""
92,2023-10-25,23-01/1-4-93,Whalebone vase with metal insert,"Whalebone oval vase with metal insert. Handmade by Jo Perano, Tory Channel, Whaling Station, South Island",1,Good,1950s,Jo Perano,Unknown,"Whalebone, metal",tinui,object,091,tinui_item,"","",""
93,2023-10-25,23-01/1-4-94,Large Ceramic Bowl with handle,Large Ceramic Bowl with handle,1,Good,Unknown,Unknown,Unknown,"Ceramic, Paint",tinui,object,092,tinui_item,"","",""
94,2023-10-25,23-01/1-4-95,Large Ceramic two-tone vase,Large Ceramic two-tone vase,1,Good,Unknown,Unknown,Unknown,"Ceramic, paint",tinui,object,093,tinui_item,"","",""
95,2023-10-25,23-01/1-4-96,"Blue, yellow, and red pillow","Blue, yellow, and red pillow",1,Good,Unknown,Unknown,Unknown,"fabric, Thread, Stuffing",tinui,object,094,tinui_item,"","",""
96,2023-10-25,23-01/1-4-97,Small woven suitcase,Small woven suitcase with brown leather caps.,1,Good,Unknown,Unknown,Unknown,"Leather, cane, thread, metal",tinui,object,095,tinui_item,"","",""
97,2023-10-25,23-01/1-4-98,Wooden bowl on a stick,Wooden bowl on a stick,1,Good,Unknown,Unknown,Unknown,Wood,tinui,object,096,tinui_item,"","",""
98,2023-10-25,23-01/1-4-99,Lions necklace with gold chain,Lions necklace with lions logo pendant and gold chain,1,Good,Unknown,Unknown,Unknown,"Metal, Paint",tinui,object,097,tinui_item,"","",""
99,2023-10-25,23-01/1-4-100,Lions Honours Board ,"Lions Honours Board with plaques, gavel, and bell. ",1,Good,Unknown,Unknown,Unknown,"Wood, Metal",tinui,object,098,tinui_item,"","",""
100,2023-10-25,23-01/1-2-1,Hand turned sewing machine,"Hand turned sewing machine on wooden base with climbing flowers painted across the plate and arm. Brand is ""Standard""",1,Good,Unknown,Unknown,Unknown,"Metal, Wood, Paint",tinui,object,099,tinui_item,"","",""
101,2023-10-25,23-01/1-2-2,Cash register,Cash register with role of reciept paper in place. Brand is Victor,1,Good,Unknown,Unknown,Unknown,"Metal, Paint, Glass, Plastic",tinui,object,100,tinui_item,"","",""
102,2023-10-25,23-01/1-2-3,Red child's tricycle,Red child's tricycle with pedals and an orange seat.,1,Good,Unknown,Unknown,Perry Family,Children,tinui,object,101,tinui_item,"","",""
103,2023-10-25,23-01/1-2-4,Spinning wheel,Spinning wheel with pedal. Bobbin is full of cream wool. ,1,Good,Unknown,Unknown,Unknown,"Metal, Wood",tinui,object,102,tinui_item,"","",""
